{
  "schema_version": "0.1.0",
  "request_id": "11111111-1111-4111-8111-111111111111",
  "agent_version_id": "calculator-v1",
  "agent_version_digest": "aaaaaaaaaaaaaaaaaaaaaaaaaaaaaaaaaaaaaaaaaaaaaaaaaaaaaaaaaaaaaaaa",
  "idempotency_key": "calculator-demo-0001",
  "input": {
    "question": "Сколько будет 19 × 23?"
  },
  "locale": "ru-RU"
}
